{"$id": "https://example.invalid/splay-am-pd/schemas/wp4_dataset_manifest_v0.1.schema.json", "$schema": "https://json-schema.org/draft/2020-12/schema", "description": "SA-02 WP-4 Track-A/Track-B derivative dataset manifest (immutable, hashed). Selection/validation/holdout namespaces must not overlap; Track-B selection is n=4/5 FCYCLE only.", "properties": {"dataset_id": {"type": "string"}, "experiment_id": {"type": "string", "const": "SPLAY-AM-PD-v0.1"}, "track": {"enum": ["A", "B"], "type": "string"}, "amendment_id": {"type": "string"}, "selection_sizes": {"items": {"type": "integer"}, "type": "array"}, "selection_rule": {"type": "string"}, "validation_size": {"type": "integer"}, "holdout_size": {"type": "integer"}, "rows": {"items": {"properties": {"key": {"type": "integer"}, "mode": {"enum": ["DELETE", "KEEP"], "type": "string"}, "n": {"type": "integer"}, "provenance": {"items": {"type": "string"}, "type": "array"}, "scaled_slack": {"type": "string"}, "source_state_id": {"type": "integer"}, "target_state_id": {"type": "integer"}}, "required": ["n", "source_state_id", "target_state_id", "mode", "key", "scaled_slack", "provenance"], "type": "object"}, "type": "array"}, "sha256": {"type": "string"}, "validation_rows_separate": {"type": "boolean", "const": true}}, "required": ["dataset_id", "experiment_id", "track", "amendment_id", "selection_sizes", "selection_rule", "validation_size", "holdout_size", "rows", "sha256"], "title": "WP-4 dataset manifest v0.1 (SA-02)", "type": "object"}
